"No.","Time","Source","Destination","Protocol","Length","Info"
"2","0.002121","127.0.0.1","127.0.0.1","TCP","74","3000  >  53220 [SYN, ACK] Seq=0 Ack=1 Win=65483 Len=0 MSS=65495 SACK_PERM=1 TSval=1672485200 TSecr=1672485198 WS=128"
"4","0.002592","127.0.0.1","127.0.0.1","TCP","67","3000  >  53220 [PSH, ACK] Seq=1 Ack=1 Win=65536 Len=1 TSval=1672485201 TSecr=1672485200"
"7","0.002752","127.0.0.1","127.0.0.1","TCP","66","3000  >  53220 [ACK] Seq=2 Ack=2 Win=65536 Len=0 TSval=1672485201 TSecr=1672485201"
"8","0.030461","127.0.0.1","127.0.0.1","TCP","132","3000  >  53220 [PSH, ACK] Seq=2 Ack=2 Win=65536 Len=66 TSval=1672485229 TSecr=1672485201"
"11","0.054982","127.0.0.1","127.0.0.1","TCP","66","3000  >  53220 [ACK] Seq=68 Ack=1026 Win=64512 Len=0 TSval=1672485253 TSecr=1672485253"
"12","0.083449","127.0.0.1","127.0.0.1","TCP","132","3000  >  53220 [PSH, ACK] Seq=68 Ack=1026 Win=65536 Len=66 TSval=1672485282 TSecr=1672485253"
"15","0.107893","127.0.0.1","127.0.0.1","TCP","66","3000  >  53220 [ACK] Seq=134 Ack=2050 Win=64512 Len=0 TSval=1672485306 TSecr=1672485306"
"16","0.136008","127.0.0.1","127.0.0.1","TCP","132","3000  >  53220 [PSH, ACK] Seq=134 Ack=2050 Win=65536 Len=66 TSval=1672485334 TSecr=1672485306"
"18","0.160702","127.0.0.1","127.0.0.1","TCP","66","3000  >  53220 [ACK] Seq=200 Ack=3074 Win=64512 Len=0 TSval=1672485359 TSecr=1672485359"
"19","0.189162","127.0.0.1","127.0.0.1","TCP","132","3000  >  53220 [PSH, ACK] Seq=200 Ack=3074 Win=65536 Len=66 TSval=1672485387 TSecr=1672485359"
"21","0.238708","127.0.0.1","127.0.0.1","TCP","132","3000  >  53220 [PSH, ACK] Seq=266 Ack=4098 Win=65536 Len=66 TSval=1672485437 TSecr=1672485412"
"23","0.285545","127.0.0.1","127.0.0.1","TCP","132","3000  >  53220 [PSH, ACK] Seq=332 Ack=5122 Win=65536 Len=66 TSval=1672485484 TSecr=1672485459"
"25","0.333196","127.0.0.1","127.0.0.1","TCP","132","3000  >  53220 [PSH, ACK] Seq=398 Ack=6146 Win=65536 Len=66 TSval=1672485531 TSecr=1672485506"
"27","0.380224","127.0.0.1","127.0.0.1","TCP","132","3000  >  53220 [PSH, ACK] Seq=464 Ack=7170 Win=65536 Len=66 TSval=1672485578 TSecr=1672485553"
"29","0.430027","127.0.0.1","127.0.0.1","TCP","132","3000  >  53220 [PSH, ACK] Seq=530 Ack=8194 Win=65536 Len=66 TSval=1672485628 TSecr=1672485602"
"31","0.481472","127.0.0.1","127.0.0.1","TCP","132","3000  >  53220 [PSH, ACK] Seq=596 Ack=9218 Win=65536 Len=66 TSval=1672485680 TSecr=1672485652"
"33","0.532542","127.0.0.1","127.0.0.1","TCP","132","3000  >  53220 [PSH, ACK] Seq=662 Ack=10242 Win=65536 Len=66 TSval=1672485731 TSecr=1672485703"
"35","0.581794","127.0.0.1","127.0.0.1","TCP","132","3000  >  53220 [PSH, ACK] Seq=728 Ack=11266 Win=65536 Len=66 TSval=1672485780 TSecr=1672485753"
"37","0.631029","127.0.0.1","127.0.0.1","TCP","132","3000  >  53220 [PSH, ACK] Seq=794 Ack=12290 Win=65536 Len=66 TSval=1672485829 TSecr=1672485803"
"39","0.680984","127.0.0.1","127.0.0.1","TCP","132","3000  >  53220 [PSH, ACK] Seq=860 Ack=13314 Win=65536 Len=66 TSval=1672485879 TSecr=1672485852"
"41","0.732387","127.0.0.1","127.0.0.1","TCP","132","3000  >  53220 [PSH, ACK] Seq=926 Ack=14338 Win=65536 Len=66 TSval=1672485931 TSecr=1672485903"
"43","0.784058","127.0.0.1","127.0.0.1","TCP","132","3000  >  53220 [PSH, ACK] Seq=992 Ack=15362 Win=65536 Len=66 TSval=1672485982 TSecr=1672485954"
"45","0.835678","127.0.0.1","127.0.0.1","TCP","132","3000  >  53220 [PSH, ACK] Seq=1058 Ack=16386 Win=65536 Len=66 TSval=1672486034 TSecr=1672486006"
"47","0.887378","127.0.0.1","127.0.0.1","TCP","132","3000  >  53220 [PSH, ACK] Seq=1124 Ack=17410 Win=65536 Len=66 TSval=1672486086 TSecr=1672486058"
"49","0.938770","127.0.0.1","127.0.0.1","TCP","132","3000  >  53220 [PSH, ACK] Seq=1190 Ack=18434 Win=65536 Len=66 TSval=1672486137 TSecr=1672486110"
"51","0.990805","127.0.0.1","127.0.0.1","TCP","132","3000  >  53220 [PSH, ACK] Seq=1256 Ack=19458 Win=65536 Len=66 TSval=1672486189 TSecr=1672486161"
"53","1.042564","127.0.0.1","127.0.0.1","TCP","132","3000  >  53220 [PSH, ACK] Seq=1322 Ack=20482 Win=65536 Len=66 TSval=1672486241 TSecr=1672486213"
"55","1.094382","127.0.0.1","127.0.0.1","TCP","132","3000  >  53220 [PSH, ACK] Seq=1388 Ack=21506 Win=65536 Len=66 TSval=1672486293 TSecr=1672486265"
"57","1.145997","127.0.0.1","127.0.0.1","TCP","132","3000  >  53220 [PSH, ACK] Seq=1454 Ack=22530 Win=65536 Len=66 TSval=1672486344 TSecr=1672486316"
"59","1.197472","127.0.0.1","127.0.0.1","TCP","132","3000  >  53220 [PSH, ACK] Seq=1520 Ack=23554 Win=65536 Len=66 TSval=1672486396 TSecr=1672486368"
"61","1.248809","127.0.0.1","127.0.0.1","TCP","132","3000  >  53220 [PSH, ACK] Seq=1586 Ack=24578 Win=65536 Len=66 TSval=1672486447 TSecr=1672486419"
"63","1.300505","127.0.0.1","127.0.0.1","TCP","132","3000  >  53220 [PSH, ACK] Seq=1652 Ack=25602 Win=65536 Len=66 TSval=1672486499 TSecr=1672486472"
"65","1.352144","127.0.0.1","127.0.0.1","TCP","132","3000  >  53220 [PSH, ACK] Seq=1718 Ack=26626 Win=65536 Len=66 TSval=1672486550 TSecr=1672486523"
"67","1.404318","127.0.0.1","127.0.0.1","TCP","132","3000  >  53220 [PSH, ACK] Seq=1784 Ack=27650 Win=65536 Len=66 TSval=1672486603 TSecr=1672486575"
"69","1.456380","127.0.0.1","127.0.0.1","TCP","132","3000  >  53220 [PSH, ACK] Seq=1850 Ack=28674 Win=65536 Len=66 TSval=1672486655 TSecr=1672486627"
"71","1.508010","127.0.0.1","127.0.0.1","TCP","132","3000  >  53220 [PSH, ACK] Seq=1916 Ack=29698 Win=65536 Len=66 TSval=1672486706 TSecr=1672486679"
"73","1.560145","127.0.0.1","127.0.0.1","TCP","132","3000  >  53220 [PSH, ACK] Seq=1982 Ack=30722 Win=65536 Len=66 TSval=1672486758 TSecr=1672486731"
"75","1.613048","127.0.0.1","127.0.0.1","TCP","132","3000  >  53220 [PSH, ACK] Seq=2048 Ack=31746 Win=65536 Len=66 TSval=1672486811 TSecr=1672486783"
"77","1.664469","127.0.0.1","127.0.0.1","TCP","132","3000  >  53220 [PSH, ACK] Seq=2114 Ack=32770 Win=65536 Len=66 TSval=1672486863 TSecr=1672486835"
"79","1.716008","127.0.0.1","127.0.0.1","TCP","132","3000  >  53220 [PSH, ACK] Seq=2180 Ack=33794 Win=65536 Len=66 TSval=1672486914 TSecr=1672486887"
"81","1.771228","127.0.0.1","127.0.0.1","TCP","132","3000  >  53220 [PSH, ACK] Seq=2246 Ack=34818 Win=65536 Len=66 TSval=1672486969 TSecr=1672486941"
"83","1.823032","127.0.0.1","127.0.0.1","TCP","132","3000  >  53220 [PSH, ACK] Seq=2312 Ack=35842 Win=65536 Len=66 TSval=1672487021 TSecr=1672486994"
"85","1.875519","127.0.0.1","127.0.0.1","TCP","132","3000  >  53220 [PSH, ACK] Seq=2378 Ack=36866 Win=65536 Len=66 TSval=1672487074 TSecr=1672487045"
"87","1.932901","127.0.0.1","127.0.0.1","TCP","132","3000  >  53220 [PSH, ACK] Seq=2444 Ack=37890 Win=65536 Len=66 TSval=1672487131 TSecr=1672487103"
"89","1.984788","127.0.0.1","127.0.0.1","TCP","132","3000  >  53220 [PSH, ACK] Seq=2510 Ack=38914 Win=65536 Len=66 TSval=1672487183 TSecr=1672487155"
"91","2.036362","127.0.0.1","127.0.0.1","TCP","132","3000  >  53220 [PSH, ACK] Seq=2576 Ack=39938 Win=65536 Len=66 TSval=1672487235 TSecr=1672487207"
"93","2.088963","127.0.0.1","127.0.0.1","TCP","132","3000  >  53220 [PSH, ACK] Seq=2642 Ack=40962 Win=65536 Len=66 TSval=1672487287 TSecr=1672487260"
"95","2.141156","127.0.0.1","127.0.0.1","TCP","132","3000  >  53220 [PSH, ACK] Seq=2708 Ack=41986 Win=65536 Len=66 TSval=1672487339 TSecr=1672487312"
"97","2.193630","127.0.0.1","127.0.0.1","TCP","132","3000  >  53220 [PSH, ACK] Seq=2774 Ack=43010 Win=65536 Len=66 TSval=1672487392 TSecr=1672487364"
"99","2.244583","127.0.0.1","127.0.0.1","TCP","132","3000  >  53220 [PSH, ACK] Seq=2840 Ack=44034 Win=65536 Len=66 TSval=1672487443 TSecr=1672487415"
"101","2.296102","127.0.0.1","127.0.0.1","TCP","132","3000  >  53220 [PSH, ACK] Seq=2906 Ack=45058 Win=65536 Len=66 TSval=1672487494 TSecr=1672487467"
"103","2.348034","127.0.0.1","127.0.0.1","TCP","132","3000  >  53220 [PSH, ACK] Seq=2972 Ack=46082 Win=65536 Len=66 TSval=1672487546 TSecr=1672487518"
"105","2.400049","127.0.0.1","127.0.0.1","TCP","132","3000  >  53220 [PSH, ACK] Seq=3038 Ack=47106 Win=65536 Len=66 TSval=1672487598 TSecr=1672487570"
"107","2.452141","127.0.0.1","127.0.0.1","TCP","132","3000  >  53220 [PSH, ACK] Seq=3104 Ack=48130 Win=65536 Len=66 TSval=1672487650 TSecr=1672487622"
"109","2.505295","127.0.0.1","127.0.0.1","TCP","132","3000  >  53220 [PSH, ACK] Seq=3170 Ack=49154 Win=65536 Len=66 TSval=1672487703 TSecr=1672487676"
"111","2.556709","127.0.0.1","127.0.0.1","TCP","132","3000  >  53220 [PSH, ACK] Seq=3236 Ack=50178 Win=65536 Len=66 TSval=1672487755 TSecr=1672487727"
"113","2.608518","127.0.0.1","127.0.0.1","TCP","132","3000  >  53220 [PSH, ACK] Seq=3302 Ack=51202 Win=65536 Len=66 TSval=1672487807 TSecr=1672487779"
"115","2.660711","127.0.0.1","127.0.0.1","TCP","132","3000  >  53220 [PSH, ACK] Seq=3368 Ack=52226 Win=65536 Len=66 TSval=1672487859 TSecr=1672487831"
"117","2.712316","127.0.0.1","127.0.0.1","TCP","132","3000  >  53220 [PSH, ACK] Seq=3434 Ack=53250 Win=65536 Len=66 TSval=1672487910 TSecr=1672487883"
"119","2.763928","127.0.0.1","127.0.0.1","TCP","132","3000  >  53220 [PSH, ACK] Seq=3500 Ack=54274 Win=65536 Len=66 TSval=1672487962 TSecr=1672487934"
"121","2.816104","127.0.0.1","127.0.0.1","TCP","132","3000  >  53220 [PSH, ACK] Seq=3566 Ack=55298 Win=65536 Len=66 TSval=1672488014 TSecr=1672487987"
"123","2.867988","127.0.0.1","127.0.0.1","TCP","132","3000  >  53220 [PSH, ACK] Seq=3632 Ack=56322 Win=65536 Len=66 TSval=1672488066 TSecr=1672488038"
"125","2.919232","127.0.0.1","127.0.0.1","TCP","132","3000  >  53220 [PSH, ACK] Seq=3698 Ack=57346 Win=65536 Len=66 TSval=1672488117 TSecr=1672488090"
"127","2.971467","127.0.0.1","127.0.0.1","TCP","132","3000  >  53220 [PSH, ACK] Seq=3764 Ack=58370 Win=65536 Len=66 TSval=1672488170 TSecr=1672488142"
"129","3.022617","127.0.0.1","127.0.0.1","TCP","132","3000  >  53220 [PSH, ACK] Seq=3830 Ack=59394 Win=65536 Len=66 TSval=1672488221 TSecr=1672488194"
"131","3.075183","127.0.0.1","127.0.0.1","TCP","132","3000  >  53220 [PSH, ACK] Seq=3896 Ack=60418 Win=65536 Len=66 TSval=1672488273 TSecr=1672488245"
"133","3.126399","127.0.0.1","127.0.0.1","TCP","132","3000  >  53220 [PSH, ACK] Seq=3962 Ack=61442 Win=65536 Len=66 TSval=1672488325 TSecr=1672488297"
"135","3.177346","127.0.0.1","127.0.0.1","TCP","132","3000  >  53220 [PSH, ACK] Seq=4028 Ack=62466 Win=65536 Len=66 TSval=1672488376 TSecr=1672488348"
"137","3.230734","127.0.0.1","127.0.0.1","TCP","132","3000  >  53220 [PSH, ACK] Seq=4094 Ack=63490 Win=65536 Len=66 TSval=1672488429 TSecr=1672488402"
"139","3.283092","127.0.0.1","127.0.0.1","TCP","132","3000  >  53220 [PSH, ACK] Seq=4160 Ack=64514 Win=65536 Len=66 TSval=1672488481 TSecr=1672488453"
"141","3.336288","127.0.0.1","127.0.0.1","TCP","132","3000  >  53220 [PSH, ACK] Seq=4226 Ack=65538 Win=65536 Len=66 TSval=1672488534 TSecr=1672488506"
"143","3.388633","127.0.0.1","127.0.0.1","TCP","132","3000  >  53220 [PSH, ACK] Seq=4292 Ack=66562 Win=65536 Len=66 TSval=1672488587 TSecr=1672488559"
"145","3.441044","127.0.0.1","127.0.0.1","TCP","132","3000  >  53220 [PSH, ACK] Seq=4358 Ack=67586 Win=65536 Len=66 TSval=1672488639 TSecr=1672488611"
"147","3.495415","127.0.0.1","127.0.0.1","TCP","132","3000  >  53220 [PSH, ACK] Seq=4424 Ack=68610 Win=65536 Len=66 TSval=1672488694 TSecr=1672488663"
"149","3.547907","127.0.0.1","127.0.0.1","TCP","132","3000  >  53220 [PSH, ACK] Seq=4490 Ack=69634 Win=65536 Len=66 TSval=1672488746 TSecr=1672488718"
"151","3.601224","127.0.0.1","127.0.0.1","TCP","132","3000  >  53220 [PSH, ACK] Seq=4556 Ack=70658 Win=65536 Len=66 TSval=1672488799 TSecr=1672488771"
"153","3.653468","127.0.0.1","127.0.0.1","TCP","132","3000  >  53220 [PSH, ACK] Seq=4622 Ack=71682 Win=65536 Len=66 TSval=1672488852 TSecr=1672488823"
"155","3.705129","127.0.0.1","127.0.0.1","TCP","132","3000  >  53220 [PSH, ACK] Seq=4688 Ack=72706 Win=65536 Len=66 TSval=1672488903 TSecr=1672488876"
"157","3.758377","127.0.0.1","127.0.0.1","TCP","132","3000  >  53220 [PSH, ACK] Seq=4754 Ack=73730 Win=65536 Len=66 TSval=1672488957 TSecr=1672488928"
"159","3.810858","127.0.0.1","127.0.0.1","TCP","132","3000  >  53220 [PSH, ACK] Seq=4820 Ack=74754 Win=65536 Len=66 TSval=1672489009 TSecr=1672488981"
"161","3.863460","127.0.0.1","127.0.0.1","TCP","132","3000  >  53220 [PSH, ACK] Seq=4886 Ack=75778 Win=65536 Len=66 TSval=1672489062 TSecr=1672489034"
"163","3.915647","127.0.0.1","127.0.0.1","TCP","132","3000  >  53220 [PSH, ACK] Seq=4952 Ack=76802 Win=65536 Len=66 TSval=1672489114 TSecr=1672489086"
"165","3.967616","127.0.0.1","127.0.0.1","TCP","132","3000  >  53220 [PSH, ACK] Seq=5018 Ack=77826 Win=65536 Len=66 TSval=1672489166 TSecr=1672489138"
"167","4.019745","127.0.0.1","127.0.0.1","TCP","132","3000  >  53220 [PSH, ACK] Seq=5084 Ack=78850 Win=65536 Len=66 TSval=1672489218 TSecr=1672489190"
"169","4.072765","127.0.0.1","127.0.0.1","TCP","132","3000  >  53220 [PSH, ACK] Seq=5150 Ack=79874 Win=65536 Len=66 TSval=1672489271 TSecr=1672489242"
"171","4.126034","127.0.0.1","127.0.0.1","TCP","132","3000  >  53220 [PSH, ACK] Seq=5216 Ack=80898 Win=65536 Len=66 TSval=1672489324 TSecr=1672489296"
"173","4.177343","127.0.0.1","127.0.0.1","TCP","132","3000  >  53220 [PSH, ACK] Seq=5282 Ack=81922 Win=65536 Len=66 TSval=1672489376 TSecr=1672489348"
"175","4.228893","127.0.0.1","127.0.0.1","TCP","132","3000  >  53220 [PSH, ACK] Seq=5348 Ack=82946 Win=65536 Len=66 TSval=1672489427 TSecr=1672489399"
"177","4.280628","127.0.0.1","127.0.0.1","TCP","132","3000  >  53220 [PSH, ACK] Seq=5414 Ack=83970 Win=65536 Len=66 TSval=1672489479 TSecr=1672489451"
"179","4.332464","127.0.0.1","127.0.0.1","TCP","132","3000  >  53220 [PSH, ACK] Seq=5480 Ack=84994 Win=65536 Len=66 TSval=1672489531 TSecr=1672489503"
"181","4.384950","127.0.0.1","127.0.0.1","TCP","132","3000  >  53220 [PSH, ACK] Seq=5546 Ack=86018 Win=65536 Len=66 TSval=1672489583 TSecr=1672489556"
"183","4.437393","127.0.0.1","127.0.0.1","TCP","132","3000  >  53220 [PSH, ACK] Seq=5612 Ack=87042 Win=65536 Len=66 TSval=1672489636 TSecr=1672489608"
"185","4.488835","127.0.0.1","127.0.0.1","TCP","132","3000  >  53220 [PSH, ACK] Seq=5678 Ack=88066 Win=65536 Len=66 TSval=1672489687 TSecr=1672489660"
"187","4.540600","127.0.0.1","127.0.0.1","TCP","132","3000  >  53220 [PSH, ACK] Seq=5744 Ack=89090 Win=65536 Len=66 TSval=1672489739 TSecr=1672489711"
"189","4.592151","127.0.0.1","127.0.0.1","TCP","132","3000  >  53220 [PSH, ACK] Seq=5810 Ack=90114 Win=65536 Len=66 TSval=1672489790 TSecr=1672489763"
"191","4.645431","127.0.0.1","127.0.0.1","TCP","132","3000  >  53220 [PSH, ACK] Seq=5876 Ack=91138 Win=65536 Len=66 TSval=1672489844 TSecr=1672489816"
"193","4.696539","127.0.0.1","127.0.0.1","TCP","132","3000  >  53220 [PSH, ACK] Seq=5942 Ack=92162 Win=65536 Len=66 TSval=1672489895 TSecr=1672489867"
"195","4.748197","127.0.0.1","127.0.0.1","TCP","132","3000  >  53220 [PSH, ACK] Seq=6008 Ack=93186 Win=65536 Len=66 TSval=1672489946 TSecr=1672489919"
"197","4.799808","127.0.0.1","127.0.0.1","TCP","132","3000  >  53220 [PSH, ACK] Seq=6074 Ack=94210 Win=65536 Len=66 TSval=1672489998 TSecr=1672489970"
"199","4.851899","127.0.0.1","127.0.0.1","TCP","132","3000  >  53220 [PSH, ACK] Seq=6140 Ack=95234 Win=65536 Len=66 TSval=1672490050 TSecr=1672490022"
"201","4.903584","127.0.0.1","127.0.0.1","TCP","132","3000  >  53220 [PSH, ACK] Seq=6206 Ack=96258 Win=65536 Len=66 TSval=1672490102 TSecr=1672490075"
"203","4.957485","127.0.0.1","127.0.0.1","TCP","132","3000  >  53220 [PSH, ACK] Seq=6272 Ack=97282 Win=65536 Len=66 TSval=1672490156 TSecr=1672490127"
"205","5.009503","127.0.0.1","127.0.0.1","TCP","132","3000  >  53220 [PSH, ACK] Seq=6338 Ack=98306 Win=65536 Len=66 TSval=1672490208 TSecr=1672490180"
"207","5.061685","127.0.0.1","127.0.0.1","TCP","132","3000  >  53220 [PSH, ACK] Seq=6404 Ack=99330 Win=65536 Len=66 TSval=1672490260 TSecr=1672490232"
"209","5.113009","127.0.0.1","127.0.0.1","TCP","132","3000  >  53220 [PSH, ACK] Seq=6470 Ack=100354 Win=65536 Len=66 TSval=1672490311 TSecr=1672490284"
"211","5.166073","127.0.0.1","127.0.0.1","TCP","132","3000  >  53220 [PSH, ACK] Seq=6536 Ack=101378 Win=65536 Len=66 TSval=1672490364 TSecr=1672490336"
"213","5.218466","127.0.0.1","127.0.0.1","TCP","132","3000  >  53220 [PSH, ACK] Seq=6602 Ack=102402 Win=65536 Len=66 TSval=1672490417 TSecr=1672490388"
"215","5.270816","127.0.0.1","127.0.0.1","TCP","132","3000  >  53220 [PSH, ACK] Seq=6668 Ack=103426 Win=65536 Len=66 TSval=1672490469 TSecr=1672490442"
"217","5.323770","127.0.0.1","127.0.0.1","TCP","132","3000  >  53220 [PSH, ACK] Seq=6734 Ack=104450 Win=65536 Len=66 TSval=1672490522 TSecr=1672490494"
"219","5.375443","127.0.0.1","127.0.0.1","TCP","132","3000  >  53220 [PSH, ACK] Seq=6800 Ack=105474 Win=65536 Len=66 TSval=1672490574 TSecr=1672490546"
"221","5.427580","127.0.0.1","127.0.0.1","TCP","132","3000  >  53220 [PSH, ACK] Seq=6866 Ack=106498 Win=65536 Len=66 TSval=1672490626 TSecr=1672490598"
"223","5.479543","127.0.0.1","127.0.0.1","TCP","132","3000  >  53220 [PSH, ACK] Seq=6932 Ack=107522 Win=65536 Len=66 TSval=1672490678 TSecr=1672490650"
"225","5.530830","127.0.0.1","127.0.0.1","TCP","132","3000  >  53220 [PSH, ACK] Seq=6998 Ack=108546 Win=65536 Len=66 TSval=1672490729 TSecr=1672490702"
"227","5.582177","127.0.0.1","127.0.0.1","TCP","132","3000  >  53220 [PSH, ACK] Seq=7064 Ack=109570 Win=65536 Len=66 TSval=1672490780 TSecr=1672490753"
"229","5.633927","127.0.0.1","127.0.0.1","TCP","132","3000  >  53220 [PSH, ACK] Seq=7130 Ack=110594 Win=65536 Len=66 TSval=1672490832 TSecr=1672490804"
"231","5.685703","127.0.0.1","127.0.0.1","TCP","132","3000  >  53220 [PSH, ACK] Seq=7196 Ack=111618 Win=65536 Len=66 TSval=1672490884 TSecr=1672490856"
"233","5.739000","127.0.0.1","127.0.0.1","TCP","132","3000  >  53220 [PSH, ACK] Seq=7262 Ack=112642 Win=65536 Len=66 TSval=1672490937 TSecr=1672490908"
"235","5.790904","127.0.0.1","127.0.0.1","TCP","132","3000  >  53220 [PSH, ACK] Seq=7328 Ack=113666 Win=65536 Len=66 TSval=1672490989 TSecr=1672490961"
"237","5.842650","127.0.0.1","127.0.0.1","TCP","132","3000  >  53220 [PSH, ACK] Seq=7394 Ack=114690 Win=65536 Len=66 TSval=1672491041 TSecr=1672491013"
"239","5.894832","127.0.0.1","127.0.0.1","TCP","132","3000  >  53220 [PSH, ACK] Seq=7460 Ack=115714 Win=65536 Len=66 TSval=1672491093 TSecr=1672491065"
"241","5.947655","127.0.0.1","127.0.0.1","TCP","132","3000  >  53220 [PSH, ACK] Seq=7526 Ack=116738 Win=65536 Len=66 TSval=1672491146 TSecr=1672491117"
"243","5.999720","127.0.0.1","127.0.0.1","TCP","132","3000  >  53220 [PSH, ACK] Seq=7592 Ack=117762 Win=65536 Len=66 TSval=1672491198 TSecr=1672491170"
"245","6.051512","127.0.0.1","127.0.0.1","TCP","132","3000  >  53220 [PSH, ACK] Seq=7658 Ack=118786 Win=65536 Len=66 TSval=1672491250 TSecr=1672491222"
"247","6.103196","127.0.0.1","127.0.0.1","TCP","132","3000  >  53220 [PSH, ACK] Seq=7724 Ack=119810 Win=65536 Len=66 TSval=1672491301 TSecr=1672491274"
"249","6.154845","127.0.0.1","127.0.0.1","TCP","132","3000  >  53220 [PSH, ACK] Seq=7790 Ack=120834 Win=65536 Len=66 TSval=1672491353 TSecr=1672491326"
"251","6.206985","127.0.0.1","127.0.0.1","TCP","132","3000  >  53220 [PSH, ACK] Seq=7856 Ack=121858 Win=65536 Len=66 TSval=1672491405 TSecr=1672491378"
"253","6.259153","127.0.0.1","127.0.0.1","TCP","132","3000  >  53220 [PSH, ACK] Seq=7922 Ack=122882 Win=65536 Len=66 TSval=1672491457 TSecr=1672491430"
"255","6.312841","127.0.0.1","127.0.0.1","TCP","132","3000  >  53220 [PSH, ACK] Seq=7988 Ack=123906 Win=65536 Len=66 TSval=1672491511 TSecr=1672491483"
"257","6.364889","127.0.0.1","127.0.0.1","TCP","132","3000  >  53220 [PSH, ACK] Seq=8054 Ack=124930 Win=65536 Len=66 TSval=1672491563 TSecr=1672491535"
"259","6.417577","127.0.0.1","127.0.0.1","TCP","132","3000  >  53220 [PSH, ACK] Seq=8120 Ack=125954 Win=65536 Len=66 TSval=1672491616 TSecr=1672491587"
"261","6.469059","127.0.0.1","127.0.0.1","TCP","132","3000  >  53220 [PSH, ACK] Seq=8186 Ack=126978 Win=65536 Len=66 TSval=1672491667 TSecr=1672491639"
"263","6.523486","127.0.0.1","127.0.0.1","TCP","132","3000  >  53220 [PSH, ACK] Seq=8252 Ack=128002 Win=65536 Len=66 TSval=1672491722 TSecr=1672491694"
"265","6.575117","127.0.0.1","127.0.0.1","TCP","132","3000  >  53220 [PSH, ACK] Seq=8318 Ack=129026 Win=65536 Len=66 TSval=1672491773 TSecr=1672491746"
"267","6.627599","127.0.0.1","127.0.0.1","TCP","132","3000  >  53220 [PSH, ACK] Seq=8384 Ack=130050 Win=65536 Len=66 TSval=1672491826 TSecr=1672491798"
"269","6.679655","127.0.0.1","127.0.0.1","TCP","132","3000  >  53220 [PSH, ACK] Seq=8450 Ack=131074 Win=65536 Len=66 TSval=1672491878 TSecr=1672491850"
"271","6.731429","127.0.0.1","127.0.0.1","TCP","132","3000  >  53220 [PSH, ACK] Seq=8516 Ack=132098 Win=65536 Len=66 TSval=1672491930 TSecr=1672491902"
"273","6.782519","127.0.0.1","127.0.0.1","TCP","132","3000  >  53220 [PSH, ACK] Seq=8582 Ack=133122 Win=65536 Len=66 TSval=1672491981 TSecr=1672491953"
"275","6.833809","127.0.0.1","127.0.0.1","TCP","132","3000  >  53220 [PSH, ACK] Seq=8648 Ack=134146 Win=65536 Len=66 TSval=1672492032 TSecr=1672492005"
"277","6.885529","127.0.0.1","127.0.0.1","TCP","132","3000  >  53220 [PSH, ACK] Seq=8714 Ack=135170 Win=65536 Len=66 TSval=1672492084 TSecr=1672492056"
"279","6.937571","127.0.0.1","127.0.0.1","TCP","132","3000  >  53220 [PSH, ACK] Seq=8780 Ack=136194 Win=65536 Len=66 TSval=1672492136 TSecr=1672492108"
"281","6.990389","127.0.0.1","127.0.0.1","TCP","132","3000  >  53220 [PSH, ACK] Seq=8846 Ack=137218 Win=65536 Len=66 TSval=1672492189 TSecr=1672492160"
"283","7.044046","127.0.0.1","127.0.0.1","TCP","132","3000  >  53220 [PSH, ACK] Seq=8912 Ack=138242 Win=65536 Len=66 TSval=1672492242 TSecr=1672492215"
"285","7.096333","127.0.0.1","127.0.0.1","TCP","132","3000  >  53220 [PSH, ACK] Seq=8978 Ack=139266 Win=65536 Len=66 TSval=1672492295 TSecr=1672492267"
"287","7.148733","127.0.0.1","127.0.0.1","TCP","132","3000  >  53220 [PSH, ACK] Seq=9044 Ack=140290 Win=65536 Len=66 TSval=1672492347 TSecr=1672492319"
"289","7.201267","127.0.0.1","127.0.0.1","TCP","132","3000  >  53220 [PSH, ACK] Seq=9110 Ack=141314 Win=65536 Len=66 TSval=1672492399 TSecr=1672492371"
"291","7.253008","127.0.0.1","127.0.0.1","TCP","132","3000  >  53220 [PSH, ACK] Seq=9176 Ack=142338 Win=65536 Len=66 TSval=1672492451 TSecr=1672492423"
"293","7.304325","127.0.0.1","127.0.0.1","TCP","132","3000  >  53220 [PSH, ACK] Seq=9242 Ack=143362 Win=65536 Len=66 TSval=1672492503 TSecr=1672492475"
"295","7.355854","127.0.0.1","127.0.0.1","TCP","132","3000  >  53220 [PSH, ACK] Seq=9308 Ack=144386 Win=65536 Len=66 TSval=1672492554 TSecr=1672492527"
"297","7.407649","127.0.0.1","127.0.0.1","TCP","132","3000  >  53220 [PSH, ACK] Seq=9374 Ack=145410 Win=65536 Len=66 TSval=1672492606 TSecr=1672492578"
"299","7.459226","127.0.0.1","127.0.0.1","TCP","132","3000  >  53220 [PSH, ACK] Seq=9440 Ack=146434 Win=65536 Len=66 TSval=1672492657 TSecr=1672492630"
"301","7.510771","127.0.0.1","127.0.0.1","TCP","132","3000  >  53220 [PSH, ACK] Seq=9506 Ack=147458 Win=65536 Len=66 TSval=1672492709 TSecr=1672492681"
"303","7.561837","127.0.0.1","127.0.0.1","TCP","132","3000  >  53220 [PSH, ACK] Seq=9572 Ack=148482 Win=65536 Len=66 TSval=1672492760 TSecr=1672492733"
"305","7.613150","127.0.0.1","127.0.0.1","TCP","132","3000  >  53220 [PSH, ACK] Seq=9638 Ack=149506 Win=65536 Len=66 TSval=1672492811 TSecr=1672492784"
"307","7.664414","127.0.0.1","127.0.0.1","TCP","132","3000  >  53220 [PSH, ACK] Seq=9704 Ack=150530 Win=65536 Len=66 TSval=1672492863 TSecr=1672492835"
"309","7.715735","127.0.0.1","127.0.0.1","TCP","132","3000  >  53220 [PSH, ACK] Seq=9770 Ack=151554 Win=65536 Len=66 TSval=1672492914 TSecr=1672492886"
"311","7.767203","127.0.0.1","127.0.0.1","TCP","132","3000  >  53220 [PSH, ACK] Seq=9836 Ack=152578 Win=65536 Len=66 TSval=1672492965 TSecr=1672492938"
"313","7.819903","127.0.0.1","127.0.0.1","TCP","132","3000  >  53220 [PSH, ACK] Seq=9902 Ack=153602 Win=65536 Len=66 TSval=1672493018 TSecr=1672492991"
"315","7.871213","127.0.0.1","127.0.0.1","TCP","132","3000  >  53220 [PSH, ACK] Seq=9968 Ack=154626 Win=65536 Len=66 TSval=1672493069 TSecr=1672493042"
"317","7.922987","127.0.0.1","127.0.0.1","TCP","132","3000  >  53220 [PSH, ACK] Seq=10034 Ack=155650 Win=65536 Len=66 TSval=1672493121 TSecr=1672493094"
"319","7.974669","127.0.0.1","127.0.0.1","TCP","132","3000  >  53220 [PSH, ACK] Seq=10100 Ack=156674 Win=65536 Len=66 TSval=1672493173 TSecr=1672493145"
"321","8.026390","127.0.0.1","127.0.0.1","TCP","132","3000  >  53220 [PSH, ACK] Seq=10166 Ack=157698 Win=65536 Len=66 TSval=1672493225 TSecr=1672493197"
"323","8.079555","127.0.0.1","127.0.0.1","TCP","132","3000  >  53220 [PSH, ACK] Seq=10232 Ack=158722 Win=65536 Len=66 TSval=1672493278 TSecr=1672493250"
"325","8.132103","127.0.0.1","127.0.0.1","TCP","132","3000  >  53220 [PSH, ACK] Seq=10298 Ack=159746 Win=65536 Len=66 TSval=1672493330 TSecr=1672493303"
"327","8.184901","127.0.0.1","127.0.0.1","TCP","132","3000  >  53220 [PSH, ACK] Seq=10364 Ack=160770 Win=65536 Len=66 TSval=1672493383 TSecr=1672493355"
"329","8.237112","127.0.0.1","127.0.0.1","TCP","132","3000  >  53220 [PSH, ACK] Seq=10430 Ack=161794 Win=65536 Len=66 TSval=1672493435 TSecr=1672493407"
"331","8.289353","127.0.0.1","127.0.0.1","TCP","132","3000  >  53220 [PSH, ACK] Seq=10496 Ack=162818 Win=65536 Len=66 TSval=1672493488 TSecr=1672493460"
"333","8.340897","127.0.0.1","127.0.0.1","TCP","132","3000  >  53220 [PSH, ACK] Seq=10562 Ack=163842 Win=65536 Len=66 TSval=1672493539 TSecr=1672493511"
"335","8.392879","127.0.0.1","127.0.0.1","TCP","132","3000  >  53220 [PSH, ACK] Seq=10628 Ack=164866 Win=65536 Len=66 TSval=1672493591 TSecr=1672493563"
"337","8.445461","127.0.0.1","127.0.0.1","TCP","132","3000  >  53220 [PSH, ACK] Seq=10694 Ack=165890 Win=65536 Len=66 TSval=1672493644 TSecr=1672493616"
"339","8.497815","127.0.0.1","127.0.0.1","TCP","132","3000  >  53220 [PSH, ACK] Seq=10760 Ack=166914 Win=65536 Len=66 TSval=1672493696 TSecr=1672493668"
"341","8.551649","127.0.0.1","127.0.0.1","TCP","132","3000  >  53220 [PSH, ACK] Seq=10826 Ack=167938 Win=65536 Len=66 TSval=1672493750 TSecr=1672493721"
"343","8.603992","127.0.0.1","127.0.0.1","TCP","132","3000  >  53220 [PSH, ACK] Seq=10892 Ack=168962 Win=65536 Len=66 TSval=1672493802 TSecr=1672493774"
"345","8.656194","127.0.0.1","127.0.0.1","TCP","132","3000  >  53220 [PSH, ACK] Seq=10958 Ack=169986 Win=65536 Len=66 TSval=1672493854 TSecr=1672493827"
"347","8.709000","127.0.0.1","127.0.0.1","TCP","132","3000  >  53220 [PSH, ACK] Seq=11024 Ack=171010 Win=65536 Len=66 TSval=1672493907 TSecr=1672493880"
"349","8.761529","127.0.0.1","127.0.0.1","TCP","132","3000  >  53220 [PSH, ACK] Seq=11090 Ack=172034 Win=65536 Len=66 TSval=1672493960 TSecr=1672493932"
"351","8.813462","127.0.0.1","127.0.0.1","TCP","132","3000  >  53220 [PSH, ACK] Seq=11156 Ack=173058 Win=65536 Len=66 TSval=1672494012 TSecr=1672493984"
"353","8.864519","127.0.0.1","127.0.0.1","TCP","132","3000  >  53220 [PSH, ACK] Seq=11222 Ack=174082 Win=65536 Len=66 TSval=1672494063 TSecr=1672494035"
"355","8.916064","127.0.0.1","127.0.0.1","TCP","132","3000  >  53220 [PSH, ACK] Seq=11288 Ack=175106 Win=65536 Len=66 TSval=1672494114 TSecr=1672494087"
"357","8.969017","127.0.0.1","127.0.0.1","TCP","132","3000  >  53220 [PSH, ACK] Seq=11354 Ack=176130 Win=65536 Len=66 TSval=1672494167 TSecr=1672494138"
"359","9.021645","127.0.0.1","127.0.0.1","TCP","132","3000  >  53220 [PSH, ACK] Seq=11420 Ack=177154 Win=65536 Len=66 TSval=1672494220 TSecr=1672494191"
"361","9.074118","127.0.0.1","127.0.0.1","TCP","132","3000  >  53220 [PSH, ACK] Seq=11486 Ack=178178 Win=65536 Len=66 TSval=1672494272 TSecr=1672494245"
"363","9.125301","127.0.0.1","127.0.0.1","TCP","132","3000  >  53220 [PSH, ACK] Seq=11552 Ack=179202 Win=65536 Len=66 TSval=1672494323 TSecr=1672494296"
"365","9.177476","127.0.0.1","127.0.0.1","TCP","132","3000  >  53220 [PSH, ACK] Seq=11618 Ack=180226 Win=65536 Len=66 TSval=1672494376 TSecr=1672494348"
"367","9.228725","127.0.0.1","127.0.0.1","TCP","132","3000  >  53220 [PSH, ACK] Seq=11684 Ack=181250 Win=65536 Len=66 TSval=1672494427 TSecr=1672494399"
"369","9.279787","127.0.0.1","127.0.0.1","TCP","132","3000  >  53220 [PSH, ACK] Seq=11750 Ack=182274 Win=65536 Len=66 TSval=1672494478 TSecr=1672494451"
"371","9.331455","127.0.0.1","127.0.0.1","TCP","132","3000  >  53220 [PSH, ACK] Seq=11816 Ack=183298 Win=65536 Len=66 TSval=1672494530 TSecr=1672494502"
"373","9.382916","127.0.0.1","127.0.0.1","TCP","132","3000  >  53220 [PSH, ACK] Seq=11882 Ack=184322 Win=65536 Len=66 TSval=1672494581 TSecr=1672494554"
"375","9.434101","127.0.0.1","127.0.0.1","TCP","132","3000  >  53220 [PSH, ACK] Seq=11948 Ack=185346 Win=65536 Len=66 TSval=1672494632 TSecr=1672494605"
"377","9.487451","127.0.0.1","127.0.0.1","TCP","132","3000  >  53220 [PSH, ACK] Seq=12014 Ack=186370 Win=65536 Len=66 TSval=1672494686 TSecr=1672494658"
"379","9.538665","127.0.0.1","127.0.0.1","TCP","132","3000  >  53220 [PSH, ACK] Seq=12080 Ack=187394 Win=65536 Len=66 TSval=1672494737 TSecr=1672494709"
"381","9.589814","127.0.0.1","127.0.0.1","TCP","132","3000  >  53220 [PSH, ACK] Seq=12146 Ack=188418 Win=65536 Len=66 TSval=1672494788 TSecr=1672494761"
"383","9.641018","127.0.0.1","127.0.0.1","TCP","132","3000  >  53220 [PSH, ACK] Seq=12212 Ack=189442 Win=65536 Len=66 TSval=1672494839 TSecr=1672494812"
"385","9.693205","127.0.0.1","127.0.0.1","TCP","132","3000  >  53220 [PSH, ACK] Seq=12278 Ack=190466 Win=65536 Len=66 TSval=1672494891 TSecr=1672494864"
"387","9.744936","127.0.0.1","127.0.0.1","TCP","132","3000  >  53220 [PSH, ACK] Seq=12344 Ack=191490 Win=65536 Len=66 TSval=1672494943 TSecr=1672494915"
"389","9.797091","127.0.0.1","127.0.0.1","TCP","132","3000  >  53220 [PSH, ACK] Seq=12410 Ack=192514 Win=65536 Len=66 TSval=1672494995 TSecr=1672494968"
"391","9.848427","127.0.0.1","127.0.0.1","TCP","132","3000  >  53220 [PSH, ACK] Seq=12476 Ack=193538 Win=65536 Len=66 TSval=1672495047 TSecr=1672495019"
"393","9.900528","127.0.0.1","127.0.0.1","TCP","132","3000  >  53220 [PSH, ACK] Seq=12542 Ack=194562 Win=65536 Len=66 TSval=1672495099 TSecr=1672495071"
"395","9.952349","127.0.0.1","127.0.0.1","TCP","132","3000  >  53220 [PSH, ACK] Seq=12608 Ack=195586 Win=65536 Len=66 TSval=1672495151 TSecr=1672495123"
"397","10.005631","127.0.0.1","127.0.0.1","TCP","132","3000  >  53220 [PSH, ACK] Seq=12674 Ack=196610 Win=65536 Len=66 TSval=1672495204 TSecr=1672495176"
"399","10.058707","127.0.0.1","127.0.0.1","TCP","132","3000  >  53220 [PSH, ACK] Seq=12740 Ack=197634 Win=65536 Len=66 TSval=1672495257 TSecr=1672495229"
"401","10.110471","127.0.0.1","127.0.0.1","TCP","132","3000  >  53220 [PSH, ACK] Seq=12806 Ack=198658 Win=65536 Len=66 TSval=1672495309 TSecr=1672495281"
"403","10.163504","127.0.0.1","127.0.0.1","TCP","132","3000  >  53220 [PSH, ACK] Seq=12872 Ack=199682 Win=65536 Len=66 TSval=1672495362 TSecr=1672495334"
"405","10.214452","127.0.0.1","127.0.0.1","TCP","132","3000  >  53220 [PSH, ACK] Seq=12938 Ack=200706 Win=65536 Len=66 TSval=1672495413 TSecr=1672495385"
"407","10.265949","127.0.0.1","127.0.0.1","TCP","132","3000  >  53220 [PSH, ACK] Seq=13004 Ack=201730 Win=65536 Len=66 TSval=1672495464 TSecr=1672495437"
"409","10.317804","127.0.0.1","127.0.0.1","TCP","132","3000  >  53220 [PSH, ACK] Seq=13070 Ack=202754 Win=65536 Len=66 TSval=1672495516 TSecr=1672495488"
"411","10.369227","127.0.0.1","127.0.0.1","TCP","132","3000  >  53220 [PSH, ACK] Seq=13136 Ack=203778 Win=65536 Len=66 TSval=1672495567 TSecr=1672495540"
"413","10.423364","127.0.0.1","127.0.0.1","TCP","132","3000  >  53220 [PSH, ACK] Seq=13202 Ack=204802 Win=65536 Len=66 TSval=1672495622 TSecr=1672495593"
"415","10.475184","127.0.0.1","127.0.0.1","TCP","132","3000  >  53220 [PSH, ACK] Seq=13268 Ack=205826 Win=65536 Len=66 TSval=1672495673 TSecr=1672495646"
"417","10.527188","127.0.0.1","127.0.0.1","TCP","132","3000  >  53220 [PSH, ACK] Seq=13334 Ack=206850 Win=65536 Len=66 TSval=1672495725 TSecr=1672495698"
"419","10.578672","127.0.0.1","127.0.0.1","TCP","132","3000  >  53220 [PSH, ACK] Seq=13400 Ack=207874 Win=65536 Len=66 TSval=1672495777 TSecr=1672495750"
"421","10.630010","127.0.0.1","127.0.0.1","TCP","132","3000  >  53220 [PSH, ACK] Seq=13466 Ack=208898 Win=65536 Len=66 TSval=1672495828 TSecr=1672495801"
"423","10.681588","127.0.0.1","127.0.0.1","TCP","132","3000  >  53220 [PSH, ACK] Seq=13532 Ack=209922 Win=65536 Len=66 TSval=1672495880 TSecr=1672495852"
"425","10.733206","127.0.0.1","127.0.0.1","TCP","132","3000  >  53220 [PSH, ACK] Seq=13598 Ack=210946 Win=65536 Len=66 TSval=1672495931 TSecr=1672495904"
"427","10.784448","127.0.0.1","127.0.0.1","TCP","132","3000  >  53220 [PSH, ACK] Seq=13664 Ack=211970 Win=65536 Len=66 TSval=1672495983 TSecr=1672495955"
"429","10.838262","127.0.0.1","127.0.0.1","TCP","132","3000  >  53220 [PSH, ACK] Seq=13730 Ack=212994 Win=65536 Len=66 TSval=1672496036 TSecr=1672496008"
"431","10.889277","127.0.0.1","127.0.0.1","TCP","132","3000  >  53220 [PSH, ACK] Seq=13796 Ack=214018 Win=65536 Len=66 TSval=1672496087 TSecr=1672496060"
"433","10.940058","127.0.0.1","127.0.0.1","TCP","132","3000  >  53220 [PSH, ACK] Seq=13862 Ack=215042 Win=65536 Len=66 TSval=1672496138 TSecr=1672496111"
"435","10.992101","127.0.0.1","127.0.0.1","TCP","132","3000  >  53220 [PSH, ACK] Seq=13928 Ack=216066 Win=65536 Len=66 TSval=1672496190 TSecr=1672496163"
"437","11.044270","127.0.0.1","127.0.0.1","TCP","132","3000  >  53220 [PSH, ACK] Seq=13994 Ack=217090 Win=65536 Len=66 TSval=1672496242 TSecr=1672496215"
"439","11.096879","127.0.0.1","127.0.0.1","TCP","132","3000  >  53220 [PSH, ACK] Seq=14060 Ack=218114 Win=65536 Len=66 TSval=1672496295 TSecr=1672496267"
"441","11.148258","127.0.0.1","127.0.0.1","TCP","132","3000  >  53220 [PSH, ACK] Seq=14126 Ack=219138 Win=65536 Len=66 TSval=1672496346 TSecr=1672496319"
"443","11.199255","127.0.0.1","127.0.0.1","TCP","132","3000  >  53220 [PSH, ACK] Seq=14192 Ack=220162 Win=65536 Len=66 TSval=1672496397 TSecr=1672496370"
"445","11.251361","127.0.0.1","127.0.0.1","TCP","132","3000  >  53220 [PSH, ACK] Seq=14258 Ack=221186 Win=65536 Len=66 TSval=1672496450 TSecr=1672496422"
"447","11.302491","127.0.0.1","127.0.0.1","TCP","132","3000  >  53220 [PSH, ACK] Seq=14324 Ack=222210 Win=65536 Len=66 TSval=1672496501 TSecr=1672496474"
"449","11.354047","127.0.0.1","127.0.0.1","TCP","132","3000  >  53220 [PSH, ACK] Seq=14390 Ack=223234 Win=65536 Len=66 TSval=1672496552 TSecr=1672496525"
"451","11.406635","127.0.0.1","127.0.0.1","TCP","132","3000  >  53220 [PSH, ACK] Seq=14456 Ack=224258 Win=65536 Len=66 TSval=1672496605 TSecr=1672496577"
"453","11.459426","127.0.0.1","127.0.0.1","TCP","132","3000  >  53220 [PSH, ACK] Seq=14522 Ack=225282 Win=65536 Len=66 TSval=1672496658 TSecr=1672496630"
"455","11.510872","127.0.0.1","127.0.0.1","TCP","132","3000  >  53220 [PSH, ACK] Seq=14588 Ack=226306 Win=65536 Len=66 TSval=1672496709 TSecr=1672496682"
"457","11.562514","127.0.0.1","127.0.0.1","TCP","132","3000  >  53220 [PSH, ACK] Seq=14654 Ack=227330 Win=65536 Len=66 TSval=1672496761 TSecr=1672496733"
"459","11.614289","127.0.0.1","127.0.0.1","TCP","132","3000  >  53220 [PSH, ACK] Seq=14720 Ack=228354 Win=65536 Len=66 TSval=1672496812 TSecr=1672496785"
"461","11.667039","127.0.0.1","127.0.0.1","TCP","132","3000  >  53220 [PSH, ACK] Seq=14786 Ack=229378 Win=65536 Len=66 TSval=1672496865 TSecr=1672496837"
"463","11.719885","127.0.0.1","127.0.0.1","TCP","132","3000  >  53220 [PSH, ACK] Seq=14852 Ack=230402 Win=65536 Len=66 TSval=1672496918 TSecr=1672496891"
"465","11.771983","127.0.0.1","127.0.0.1","TCP","132","3000  >  53220 [PSH, ACK] Seq=14918 Ack=231426 Win=65536 Len=66 TSval=1672496970 TSecr=1672496943"
"467","11.823062","127.0.0.1","127.0.0.1","TCP","132","3000  >  53220 [PSH, ACK] Seq=14984 Ack=232450 Win=65536 Len=66 TSval=1672497021 TSecr=1672496994"
"469","11.875642","127.0.0.1","127.0.0.1","TCP","132","3000  >  53220 [PSH, ACK] Seq=15050 Ack=233474 Win=65536 Len=66 TSval=1672497074 TSecr=1672497045"
"471","11.927550","127.0.0.1","127.0.0.1","TCP","132","3000  >  53220 [PSH, ACK] Seq=15116 Ack=234498 Win=65536 Len=66 TSval=1672497126 TSecr=1672497098"
"473","11.980631","127.0.0.1","127.0.0.1","TCP","132","3000  >  53220 [PSH, ACK] Seq=15182 Ack=235522 Win=65536 Len=66 TSval=1672497179 TSecr=1672497150"
"475","12.032448","127.0.0.1","127.0.0.1","TCP","132","3000  >  53220 [PSH, ACK] Seq=15248 Ack=236546 Win=65536 Len=66 TSval=1672497231 TSecr=1672497203"
"477","12.085735","127.0.0.1","127.0.0.1","TCP","132","3000  >  53220 [PSH, ACK] Seq=15314 Ack=237570 Win=65536 Len=66 TSval=1672497284 TSecr=1672497257"
"479","12.137534","127.0.0.1","127.0.0.1","TCP","132","3000  >  53220 [PSH, ACK] Seq=15380 Ack=238594 Win=65536 Len=66 TSval=1672497336 TSecr=1672497308"
"481","12.189305","127.0.0.1","127.0.0.1","TCP","132","3000  >  53220 [PSH, ACK] Seq=15446 Ack=239618 Win=65536 Len=66 TSval=1672497387 TSecr=1672497360"
"483","12.241092","127.0.0.1","127.0.0.1","TCP","132","3000  >  53220 [PSH, ACK] Seq=15512 Ack=240642 Win=65536 Len=66 TSval=1672497439 TSecr=1672497412"
"485","12.292205","127.0.0.1","127.0.0.1","TCP","132","3000  >  53220 [PSH, ACK] Seq=15578 Ack=241666 Win=65536 Len=66 TSval=1672497490 TSecr=1672497463"
"487","12.344235","127.0.0.1","127.0.0.1","TCP","132","3000  >  53220 [PSH, ACK] Seq=15644 Ack=242690 Win=65536 Len=66 TSval=1672497542 TSecr=1672497515"
"489","12.395462","127.0.0.1","127.0.0.1","TCP","132","3000  >  53220 [PSH, ACK] Seq=15710 Ack=243714 Win=65536 Len=66 TSval=1672497594 TSecr=1672497566"
"491","12.447701","127.0.0.1","127.0.0.1","TCP","132","3000  >  53220 [PSH, ACK] Seq=15776 Ack=244738 Win=65536 Len=66 TSval=1672497646 TSecr=1672497618"
"493","12.500001","127.0.0.1","127.0.0.1","TCP","132","3000  >  53220 [PSH, ACK] Seq=15842 Ack=245762 Win=65536 Len=66 TSval=1672497698 TSecr=1672497671"
"495","12.552489","127.0.0.1","127.0.0.1","TCP","132","3000  >  53220 [PSH, ACK] Seq=15908 Ack=246786 Win=65536 Len=66 TSval=1672497751 TSecr=1672497722"
"497","12.604564","127.0.0.1","127.0.0.1","TCP","132","3000  >  53220 [PSH, ACK] Seq=15974 Ack=247810 Win=65536 Len=66 TSval=1672497803 TSecr=1672497775"
"499","12.656438","127.0.0.1","127.0.0.1","TCP","132","3000  >  53220 [PSH, ACK] Seq=16040 Ack=248834 Win=65536 Len=66 TSval=1672497855 TSecr=1672497827"
"501","12.707718","127.0.0.1","127.0.0.1","TCP","132","3000  >  53220 [PSH, ACK] Seq=16106 Ack=249858 Win=65536 Len=66 TSval=1672497906 TSecr=1672497879"
"503","12.759718","127.0.0.1","127.0.0.1","TCP","132","3000  >  53220 [PSH, ACK] Seq=16172 Ack=250882 Win=65536 Len=66 TSval=1672497958 TSecr=1672497930"
"505","12.811559","127.0.0.1","127.0.0.1","TCP","132","3000  >  53220 [PSH, ACK] Seq=16238 Ack=251906 Win=65536 Len=66 TSval=1672498010 TSecr=1672497982"
"507","12.863307","127.0.0.1","127.0.0.1","TCP","132","3000  >  53220 [PSH, ACK] Seq=16304 Ack=252930 Win=65536 Len=66 TSval=1672498061 TSecr=1672498034"
"509","12.915046","127.0.0.1","127.0.0.1","TCP","132","3000  >  53220 [PSH, ACK] Seq=16370 Ack=253954 Win=65536 Len=66 TSval=1672498113 TSecr=1672498086"
"511","12.967695","127.0.0.1","127.0.0.1","TCP","132","3000  >  53220 [PSH, ACK] Seq=16436 Ack=254978 Win=65536 Len=66 TSval=1672498166 TSecr=1672498138"
"513","13.018968","127.0.0.1","127.0.0.1","TCP","132","3000  >  53220 [PSH, ACK] Seq=16502 Ack=256002 Win=65536 Len=66 TSval=1672498217 TSecr=1672498190"
"515","13.072359","127.0.0.1","127.0.0.1","TCP","132","3000  >  53220 [PSH, ACK] Seq=16568 Ack=257026 Win=65536 Len=66 TSval=1672498271 TSecr=1672498241"
"517","13.124197","127.0.0.1","127.0.0.1","TCP","132","3000  >  53220 [PSH, ACK] Seq=16634 Ack=258050 Win=65536 Len=66 TSval=1672498322 TSecr=1672498295"
"519","13.176208","127.0.0.1","127.0.0.1","TCP","132","3000  >  53220 [PSH, ACK] Seq=16700 Ack=259074 Win=65536 Len=66 TSval=1672498374 TSecr=1672498346"
"521","13.227641","127.0.0.1","127.0.0.1","TCP","132","3000  >  53220 [PSH, ACK] Seq=16766 Ack=260098 Win=65536 Len=66 TSval=1672498426 TSecr=1672498398"
"523","13.278908","127.0.0.1","127.0.0.1","TCP","132","3000  >  53220 [PSH, ACK] Seq=16832 Ack=261122 Win=65536 Len=66 TSval=1672498477 TSecr=1672498450"
"525","13.331388","127.0.0.1","127.0.0.1","TCP","132","3000  >  53220 [PSH, ACK] Seq=16898 Ack=262146 Win=65536 Len=66 TSval=1672498530 TSecr=1672498502"
